{
  "$schema": "../../../schema/equipment-rules.schema.json",
  "id": "coins",
  "source": {
    "book": "Livro do Jogador 2024",
    "language": "pt-BR",
    "chapter": 6,
    "chapterTitle": "Equipamento",
    "pdfPath": "doc/livro-jogador.pdf",
    "pageRanges": [
      [
        219,
        219
      ],
      [
        226,
        239
      ]
    ],
    "extractedAt": "2026-06-25T01:39:43.402Z"
  },
  "description": "Os personagens geralmente encontram moedas em\nsuas aventuras e podem gastá-las em lojas, estalagens\ne outros estabelecimentos. As moedas vêm em diferentes denominações com base no valor relativo de seu\nmaterial. A tabela Valores das Moedas lista as moedas\ne quanto elas valem em relação à Peça de Ouro, que é\na moeda principal do jogo. Por exemplo, 100 Peças de\nCobre valem 1 Peça de Ouro.\nUma moeda pesa cerca de dez gramas, então cem\nmoedas pesam um quilo.",
  "coins": [
    {
      "id": "cp",
      "name": "Peça de Cobre",
      "abbreviation": "PC",
      "valueInGp": 0.01,
      "valueLabel": "1/100"
    },
    {
      "id": "sp",
      "name": "Peça de Prata",
      "abbreviation": "PP",
      "valueInGp": 0.1,
      "valueLabel": "1/10"
    },
    {
      "id": "ep",
      "name": "Peça de Electro",
      "abbreviation": "PE",
      "valueInGp": 0.5,
      "valueLabel": "1/2"
    },
    {
      "id": "gp",
      "name": "Peça de Ouro",
      "abbreviation": "PO",
      "valueInGp": 1,
      "valueLabel": "1"
    },
    {
      "id": "pp",
      "name": "Peça de Platina",
      "abbreviation": "PL",
      "valueInGp": 10,
      "valueLabel": "10"
    }
  ]
}